{
  "schemaVersion": 1,
  "workOrderId": "OPE-16",
  "issue": "OPE-16",
  "title": "DF-002: Handle empty Perplexity choices in backend query engine",
  "brief": "Fix custom_query so an API response with an empty choices list does not raise IndexError. This is the second small supervised Dark Factory run.",
  "repo": {
    "name": "backend-legal",
    "url": "https://github.com/aila-code/backend-legal",
    "baseBranch": "stage",
    "workingDir": "/Users/samuelimini/Development/Dev/dark-factory-ticket-002/backend-legal",
    "branch": "dark-factory/ticket-002-small-bugfix"
  },
  "changeType": "code",
  "allowedWriteScope": [
    "app/services/query_engine.py",
    "tests/unit/test_services_query_engine.py"
  ],
  "acceptanceContract": {
    "frozen": true,
    "intentConfirmation": {
      "required": false,
      "status": "not_required"
    },
    "criteria": [
      {
        "id": "AC1",
        "statement": "custom_query does not raise IndexError when the API response contains choices: [].",
        "verification": "Focused unit regression test exercises custom_query with an empty choices API response.",
        "holdout": false
      },
      {
        "id": "AC2",
        "statement": "custom_query still returns formatted Sources output when citations are present.",
        "verification": "Existing and new query engine tests pass.",
        "holdout": false
      },
      {
        "id": "AC3",
        "statement": "Existing response parsing behavior for a normal choices payload remains unchanged.",
        "verification": "Focused query engine unit tests pass.",
        "holdout": false
      }
    ]
  },
  "coordination": {
    "agentEndpoints": [
      "codex-builder",
      "claude-judge"
    ],
    "messageTopology": "Foreman-mediated handoff; OPE-16, run manifest, ledger events, and gate files are the source of truth.",
    "authorityDistribution": "Foreman owns stage advancement, evidence checks, No Mistakes, push, and PR commands.",
    "syncMode": "bounded async review with typed verdict files",
    "aggregation": "typed PASS/FAIL/PARTIAL/BLOCKED verdicts with evidence refs",
    "termination": "stop on PASS, budget exhaustion, or BLOCKED escalation",
    "failureHandling": "retry inside loop budget, then escalate without pretending success",
    "informationPolicy": "builder sees the frozen contract; hidden holdouts stay with the independent judge",
    "computeAccounting": "record model/tool usage estimates as evidence, not billing truth"
  },
  "gates": {
    "tests": true,
    "securityReview": true,
    "browserQa": false,
    "noMistakes": true,
    "evidence": true,
    "pr": true
  },
  "loop": {
    "maxIterations": 3,
    "timeBudgetMinutes": 60,
    "judge": "Claude Opus 4.8 max independent review after Codex build",
    "escalateOnExhaustion": true
  },
  "loops": [
    {
      "id": "plan-adversarial-review",
      "kind": "plan_adversarial_review",
      "owner": "orchestra, Foreman, and Claude workers",
      "trigger": "Immediately after the planning team returns a plan and before implementation starts, push back to the planning team exactly once and ask: Is there anything else that has been missed? Are there any errors? Are there any conflicts in the plan?",
      "maxIterations": 1,
      "timeBudgetMinutes": 10,
      "judge": "Foreman verifies the one planning-team challenge was sent once and the response or lack of response was recorded before implementation proceeds.",
      "memory": "Ticket comments, Foreman loop event, run manifest, and evidence/source of truth for the planning-team response or lack of response.",
      "evidence": [
        "plan_adversarial_review"
      ],
      "exitCondition": "The one adversarial plan challenge is recorded with the planning team response or lack of response.",
      "escalation": "If the challenge finds missed work, errors, or conflicts, return to the planning team for correction before implementation proceeds.",
      "escalateOnExhaustion": true
    }
  ],
  "risk": {
    "tier": "low",
    "reason": "Small parser robustness fix for an external API response shape; no schema, auth, vendor config, or UI change."
  },
  "evidenceRequirements": [
    "test",
    "security_review"
  ],
  "taskRoute": {
    "schemaVersion": 1,
    "kind": "legal_dev_app",
    "source": "Bundled Dark Factory WorkOrder OPE-16",
    "decision": "This WorkOrder is explicitly routed to the legal/dev app under aila-code, not main app stage.",
    "repoUrl": "https://github.com/aila-code/backend-legal",
    "baseBranch": "stage",
    "branch": "dark-factory/ticket-002-small-bugfix",
    "localPath": "/Users/samuelimini/Development/Dev/dark-factory-ticket-002/backend-legal",
    "difficulty": "D2",
    "mode": "mode2",
    "changeType": "code",
    "prBacked": true,
    "browserQa": false,
    "userFlow": false,
    "userVisible": false,
    "requiredLanes": [
      "foreman",
      "planning",
      "implementation",
      "verification",
      "security",
      "no_mistakes",
      "pr",
      "self_improvement"
    ],
    "evidenceRequirements": [
      "test",
      "security_review"
    ]
  }
}
