{
  "schemaVersion": 1,
  "workOrderId": "OPE-30",
  "issue": "OPE-30",
  "title": "DF-009: Make auth email masking safe for empty local parts",
  "brief": "Fix the auth logging helper _mask_email so malformed addresses with an empty local part, such as @example.com, do not raise IndexError while masking. Preserve the existing masking behavior for valid emails and invalid/no-at input.",
  "repo": {
    "name": "backend-legal",
    "url": "https://github.com/aila-code/backend-legal",
    "baseBranch": "stage",
    "workingDir": "/Users/samuelimini/Development/Dev/dark-factory-ticket-009/backend-legal",
    "branch": "dark-factory/ticket-009-small-bugfix"
  },
  "changeType": "code",
  "allowedWriteScope": [
    "app/services/auth.py",
    "tests/integration/test_services_auth_extended.py"
  ],
  "acceptanceContract": {
    "frozen": true,
    "intentConfirmation": {
      "required": false,
      "status": "not_required"
    },
    "criteria": [
      {
        "id": "AC1",
        "statement": "_mask_email(\"samuel@example.com\") keeps the existing first-character mask shape.",
        "verification": "Focused test asserts the helper returns s***@example.com.",
        "holdout": false
      },
      {
        "id": "AC2",
        "statement": "_mask_email(\"plain\") and empty input still return ***.",
        "verification": "Focused test covers no-at and empty input.",
        "holdout": false
      },
      {
        "id": "AC3",
        "statement": "_mask_email(\"@example.com\") does not raise and returns a safe masked string with no local PII.",
        "verification": "Focused test covers empty-local input and asserts safe masked output.",
        "holdout": false
      },
      {
        "id": "AC4",
        "statement": "Focused auth extended tests pass.",
        "verification": "Run tests/integration/test_services_auth_extended.py.",
        "holdout": false
      }
    ]
  },
  "coordination": {
    "agentEndpoints": [
      "codex-builder",
      "claude-judge"
    ],
    "messageTopology": "Foreman-mediated handoff; OPE-30, run manifest, ledger events, and gate files are the source of truth.",
    "authorityDistribution": "Foreman owns stage advancement, evidence checks, No Mistakes, push, and PR commands.",
    "syncMode": "bounded async review with typed verdict files",
    "aggregation": "typed PASS/FAIL/PARTIAL/BLOCKED verdicts with evidence refs",
    "termination": "stop on PASS, budget exhaustion, or BLOCKED escalation",
    "failureHandling": "retry inside loop budget, then escalate without pretending success",
    "informationPolicy": "builder sees the frozen contract; hidden holdouts stay with the independent judge",
    "computeAccounting": "record model/tool usage estimates as evidence, not billing truth"
  },
  "gates": {
    "tests": true,
    "securityReview": true,
    "browserQa": false,
    "noMistakes": true,
    "evidence": true,
    "pr": true
  },
  "loop": {
    "maxIterations": 3,
    "timeBudgetMinutes": 60,
    "judge": "Claude Opus 4.8 max independent review after Codex build",
    "escalateOnExhaustion": true
  },
  "loops": [
    {
      "id": "plan-adversarial-review",
      "kind": "plan_adversarial_review",
      "owner": "orchestra, Foreman, and Claude workers",
      "trigger": "Immediately after the planning team returns a plan and before implementation starts, push back to the planning team exactly once and ask: Is there anything else that has been missed? Are there any errors? Are there any conflicts in the plan?",
      "maxIterations": 1,
      "timeBudgetMinutes": 10,
      "judge": "Foreman verifies the one planning-team challenge was sent once and the response or lack of response was recorded before implementation proceeds.",
      "memory": "Ticket comments, Foreman loop event, run manifest, and evidence/source of truth for the planning-team response or lack of response.",
      "evidence": [
        "plan_adversarial_review"
      ],
      "exitCondition": "The one adversarial plan challenge is recorded with the planning team response or lack of response.",
      "escalation": "If the challenge finds missed work, errors, or conflicts, return to the planning team for correction before implementation proceeds.",
      "escalateOnExhaustion": true
    }
  ],
  "risk": {
    "tier": "low",
    "reason": "Small logging helper change for malformed email masking; no auth decision logic or persistence semantics should change."
  },
  "evidenceRequirements": [
    "pre_fix_reproduction",
    "test",
    "security_review"
  ],
  "taskRoute": {
    "schemaVersion": 1,
    "kind": "legal_dev_app",
    "source": "Bundled Dark Factory WorkOrder OPE-30",
    "decision": "This WorkOrder is explicitly routed to the legal/dev app under aila-code, not main app stage.",
    "repoUrl": "https://github.com/aila-code/backend-legal",
    "baseBranch": "stage",
    "branch": "dark-factory/ticket-009-small-bugfix",
    "localPath": "/Users/samuelimini/Development/Dev/dark-factory-ticket-009/backend-legal",
    "difficulty": "D2",
    "mode": "mode2",
    "changeType": "code",
    "prBacked": true,
    "browserQa": false,
    "userFlow": false,
    "userVisible": false,
    "requiredLanes": [
      "foreman",
      "planning",
      "implementation",
      "verification",
      "security",
      "no_mistakes",
      "pr",
      "self_improvement"
    ],
    "evidenceRequirements": [
      "pre_fix_reproduction",
      "test",
      "security_review"
    ]
  }
}
